{
  "$schema": "./alice-book.utterances.schema.json",
  "source": {
    "title": "Alice's Adventures in Wonderland",
    "author": "Lewis Carroll",
    "coverage": "Chapters I-VI",
    "attribution": "Project Gutenberg eBook #11 (public domain).",
    "url": "https://www.gutenberg.org/files/11/11-h/11-h.htm",
    "note": "Spoken dialogue only (excludes narration and silent thought/\"said to herself\" asides), extracted from Chapters I-VI. Text is in the public domain; this fixture is for local/dev caption playback."
  },
  "speakers": [
    "alice",
    "bill",
    "canary",
    "caterpillar",
    "cheshire_cat",
    "cook",
    "crab",
    "dodo",
    "duchess",
    "duck",
    "eaglet",
    "fish_footman",
    "frog_footman",
    "lory",
    "magpie",
    "mouse",
    "pat",
    "pigeon",
    "white_rabbit",
    "young_crab"
  ],
  "loop": true,
  "turnCount": 168,
  "lineCount": 363,
  "turns": [
    {
      "speaker": "white_rabbit",
      "lines": ["Oh dear! Oh dear! I shall be late!"]
    },
    {
      "speaker": "alice",
      "lines": [
        "I wonder how many miles I've fallen by this time?",
        "I must be getting somewhere near the centre of the earth. Let me see: that would be four thousand miles down, I think—yes, that's about the right distance—but then I wonder what Latitude or Longitude I've got to?",
        "I wonder if I shall fall right through the earth! How funny it'll seem to come out among the people that walk with their heads downward! The Antipathies, I think—but I shall have to ask them what the name of the country is, you know. Please, Ma'am, is this New Zealand or Australia?",
        "And what an ignorant little girl she'll think me for asking! No, it'll never do to ask: perhaps I shall see it written up somewhere.",
        "Dinah'll miss me very much to-night, I should think! I hope they'll remember her saucer of milk at tea-time. Dinah my dear! I wish you were down here with me! There are no mice in the air, I'm afraid, but you might catch a bat, and that's very like a mouse, you know. But do cats eat bats, I wonder?",
        "Do cats eat bats? Do cats eat bats?",
        "Do bats eat cats?",
        "Now, Dinah, tell me the truth: did you ever eat a bat?"
      ]
    },
    {
      "speaker": "white_rabbit",
      "lines": ["Oh my ears and whiskers, how late it's getting!"]
    },
    {
      "speaker": "alice",
      "lines": [
        "What a curious feeling!",
        "I must be shutting up like a telescope.",
        "for it might end, you know, in my going out altogether, like a candle.",
        "I wonder what I should be like then?",
        "Come, there's no use in crying like that!",
        "I advise you to leave off this minute!",
        "which certainly was not here before.",
        "No, I'll look first, and see whether it's marked 'poison' or not.",
        "Well, I'll eat it, and if it makes me grow larger, I can reach the key; and if it makes me grow smaller, I can creep under the door; so either way I'll get into the garden, and I don't care which happens!",
        "Which way? Which way?",
        "Curiouser and curiouser!",
        "now I'm opening out like the largest telescope that ever was! Good-bye, feet!",
        "Oh, my poor little feet, I wonder who will put on your shoes and stockings for you now, dears? I'm sure I shan't be able! I shall be a great deal too far off to trouble myself about you: you must manage the best way you can; but I must be kind to them, or perhaps they won't walk the way I want to go! Let me see: I'll give them a new pair of boots every Christmas.",
        "You ought to be ashamed of yourself, a great girl like you, to go on crying in this way! Stop this moment, I tell you!"
      ]
    },
    {
      "speaker": "white_rabbit",
      "lines": [
        "Oh! the Duchess, the Duchess! Oh! won't she be savage if I've kept her waiting!"
      ]
    },
    {
      "speaker": "alice",
      "lines": [
        "If you please, sir—",
        "Dear, dear! How queer everything is to-day! And yesterday things went on just as usual. I wonder if I've been changed in the night? Let me think: was I the same when I got up this morning? I almost think I can remember feeling a little different. But if I'm not the same, the next question is, Who in the world am I? Ah, that's the great puzzle!",
        "I'm sure I'm not Ada, for her hair goes in such long ringlets, and mine doesn't go in ringlets at all; and I'm sure I can't be Mabel, for I know all sorts of things, and she, oh! she knows such a very little!",
        "Besides, she's she, and I'm I, and—oh dear, how puzzling it all is! I'll try if I know all the things I used to know. Let me see: four times five is twelve, and four times six is thirteen, and four times seven is—oh dear! I shall never get to twenty at that rate!",
        "However, the Multiplication Table doesn't signify: let's try Geography. London is the capital of Paris, and Paris is the capital of Rome, and Rome—no, that's all wrong, I'm certain! I must have been changed for Mabel! I'll try and say 'How doth the little—'",
        "How doth the little crocodile Improve his shining tail, And pour the waters of the Nile On every golden scale!",
        "How cheerfully he seems to grin, How neatly spread his claws, And welcome little fishes in With gently smiling jaws!",
        "I'm sure those are not the right words,",
        "I must be Mabel after all, and I shall have to go and live in that poky little house, and have next to no toys to play with, and oh! ever so many lessons to learn! No, I've made up my mind about it; if I'm Mabel, I'll stay down here! It'll be no use their putting their heads down and saying 'Come up again, dear!' I shall only look up and say 'Who am I then? Tell me that first, and then, if I like being that person, I'll come up: if not, I'll stay down here till I'm somebody else'—but, oh dear!",
        "I do wish they would put their heads down! I am so very tired of being all alone here!",
        "That was a narrow escape!",
        "and now for the garden!",
        "and in that case I can go back by railway.",
        "I wish I hadn't cried so much!",
        "I shall be punished for it now, I suppose, by being drowned in my own tears! That will be a queer thing, to be sure! However, everything is queer to-day.",
        "O Mouse, do you know the way out of this pool? I am very tired of swimming about here, O Mouse!",
        "Où est ma chatte?",
        "Oh, I beg your pardon!",
        "I quite forgot you didn't like cats."
      ]
    },
    {
      "speaker": "mouse",
      "lines": ["Not like cats!", "Would you like cats if you were me?"]
    },
    {
      "speaker": "alice",
      "lines": [
        "Well, perhaps not,",
        "don't be angry about it. And yet I wish I could show you our cat Dinah: I think you'd take a fancy to cats if you could only see her. She is such a dear quiet thing,",
        "and she sits purring so nicely by the fire, licking her paws and washing her face—and she is such a nice soft thing to nurse—and she's such a capital one for catching mice—oh, I beg your pardon!",
        "We won't talk about her any more if you'd rather not."
      ]
    },
    {
      "speaker": "mouse",
      "lines": [
        "We indeed!",
        "As if I would talk on such a subject! Our family always hated cats: nasty, low, vulgar things! Don't let me hear the name again!"
      ]
    },
    {
      "speaker": "alice",
      "lines": [
        "I won't indeed!",
        "Are you—are you fond—of—of dogs?",
        "There is such a nice little dog near our house I should like to show you! A little bright-eyed terrier, you know, with oh, such long curly brown hair! And it'll fetch things when you throw them, and it'll sit up and beg for its dinner, and all sorts of things—I can't remember half of them—and it belongs to a farmer, you know, and he says it's so useful, it's worth a hundred pounds! He says it kills all the rats and—oh dear!",
        "I'm afraid I've offended it again!",
        "Mouse dear! Do come back again, and we won't talk about cats or dogs either, if you don't like them!"
      ]
    },
    {
      "speaker": "mouse",
      "lines": [
        "Let us get to the shore, and then I'll tell you my history, and you'll understand why it is I hate cats and dogs."
      ]
    },
    {
      "speaker": "lory",
      "lines": ["I am older than you, and must know better;"]
    },
    {
      "speaker": "mouse",
      "lines": [
        "Sit down, all of you, and listen to me! I'll soon make you dry enough!",
        "Ahem!",
        "are you all ready? This is the driest thing I know. Silence all round, if you please! 'William the Conqueror, whose cause was favoured by the pope, was soon submitted to by the English, who wanted leaders, and had been of late much accustomed to usurpation and conquest. Edwin and Morcar, the earls of Mercia and Northumbria—'"
      ]
    },
    {
      "speaker": "lory",
      "lines": ["Ugh!"]
    },
    {
      "speaker": "mouse",
      "lines": ["I beg your pardon!", "Did you speak?"]
    },
    {
      "speaker": "lory",
      "lines": ["Not I!"]
    },
    {
      "speaker": "mouse",
      "lines": [
        "I thought you did,",
        "I proceed. 'Edwin and Morcar, the earls of Mercia and Northumbria, declared for him: and even Stigand, the patriotic archbishop of Canterbury, found it advisable—'"
      ]
    },
    {
      "speaker": "duck",
      "lines": ["Found what?"]
    },
    {
      "speaker": "mouse",
      "lines": ["Found it,", "of course you know what 'it' means."]
    },
    {
      "speaker": "duck",
      "lines": [
        "I know what 'it' means well enough, when I find a thing,",
        "it's generally a frog or a worm. The question is, what did the archbishop find?"
      ]
    },
    {
      "speaker": "mouse",
      "lines": [